{
  "schemaVersion": 1,
  "id": "article:agent-auditable-research",
  "slug": "agent-auditable-research",
  "title": "The Future of Publishing Is Agent-Auditable Research",
  "canonicalPath": "/articles/agent-auditable-research/",
  "sourcePath": "content/articles/2026/agent-auditable-research/article.md",
  "agentBriefPath": "content/articles/2026/agent-auditable-research/agent.md",
  "thesis": "The future of serious publishing is human-authored research that agents can audit: readable essays backed by claim graphs, evidence ledgers, provenance, revision history, and disclosed agent involvement.",
  "status": "published",
  "maturity": "seed",
  "publishedAt": "2026-06-17",
  "updatedAt": "2026-06-17",
  "audiences": [
    "independent researchers",
    "students",
    "technical readers",
    "AI agents"
  ],
  "topics": [
    "ai-native-publishing",
    "research-workflows",
    "agent-provenance",
    "digital-gardens"
  ],
  "claims": [
    {
      "id": "claim-001",
      "claim": "Polished prose is becoming cheap; inspectable reasoning is becoming scarce.",
      "confidence": "high",
      "status": "core",
      "evidence": [
        "source-agentic-publications-2025",
        "source-provenance-2026"
      ],
      "counterevidence": [
        "High-quality human judgment and taste remain hard to automate; the claim is about the marginal cost of competent prose, not the end of authorship."
      ]
    },
    {
      "id": "claim-002",
      "claim": "A future-ready publishing artifact should pair a human essay with a claim graph, evidence ledger, provenance, revision history, and agent contribution record.",
      "confidence": "medium-high",
      "status": "proposal",
      "evidence": [
        "source-agentic-publications-2025",
        "source-llms-txt",
        "source-digital-gardens-appleton"
      ],
      "counterevidence": [
        "The exact schema is not standardized and may vary by community."
      ]
    },
    {
      "id": "claim-003",
      "claim": "Research is the best first wedge because the audience already values citations, methods, uncertainty, and credibility.",
      "confidence": "medium",
      "status": "argument",
      "evidence": [
        "source-agentic-publications-2025",
        "source-nng-cognitive-load"
      ],
      "counterevidence": [
        "Mainstream publishing may adopt agent workflows faster if distribution incentives are stronger."
      ]
    },
    {
      "id": "claim-004",
      "claim": "Existing publishing, AI research, and protocol tools solve important pieces but not the combined readable-plus-auditable source object.",
      "confidence": "medium-high",
      "status": "landscape",
      "evidence": [
        "source-wordpress-mcp-adapter",
        "source-beehiiv-mcp-v2",
        "source-cloudflare-emdash",
        "source-agentic-publications-2025"
      ],
      "counterevidence": [
        "Some tools may evolve into this combined artifact quickly."
      ]
    },
    {
      "id": "claim-005",
      "claim": "AI assistance should be disclosed while the human remains accountable for thesis, source selection, wording, and conclusions.",
      "confidence": "high",
      "status": "normative",
      "evidence": [
        "source-provenance-2026",
        "source-agentic-publications-2025"
      ],
      "counterevidence": [
        "Disclosure norms differ by venue and are still evolving."
      ]
    },
    {
      "id": "claim-006",
      "claim": "Attention-aware reading and machine-readable structure are compatible when the page uses progressive disclosure.",
      "confidence": "medium-high",
      "status": "design",
      "evidence": [
        "source-nng-cognitive-load",
        "source-digital-gardens-appleton",
        "source-digital-gardens-qu"
      ],
      "counterevidence": [
        "Badly implemented progressive disclosure can hide important context."
      ]
    }
  ],
  "sources": [
    {
      "id": "source-agentic-publications-2025",
      "title": "Agentic Publications: An LLM-Driven Framework for Interactive Scientific Publishing",
      "url": "https://arxiv.org/abs/2505.13246",
      "type": "research",
      "accessed": "2026-06-17"
    },
    {
      "id": "source-provenance-2026",
      "title": "Responsible Agentic AI Requires Explicit Provenance",
      "url": "https://arxiv.org/abs/2605.17169",
      "type": "research",
      "accessed": "2026-06-17"
    },
    {
      "id": "source-wordpress-mcp-adapter",
      "title": "From Abilities to AI Agents: Introducing the WordPress MCP Adapter",
      "url": "https://developer.wordpress.org/news/2026/02/from-abilities-to-ai-agents-introducing-the-wordpress-mcp-adapter/",
      "type": "product",
      "accessed": "2026-06-17"
    },
    {
      "id": "source-beehiiv-mcp-v2",
      "title": "beehiiv MCP v2",
      "url": "https://product.beehiiv.com/p/beehiiv-mcp-v2",
      "type": "product",
      "accessed": "2026-06-17"
    },
    {
      "id": "source-cloudflare-emdash",
      "title": "Introducing EmDash",
      "url": "https://blog.cloudflare.com/emdash-wordpress/",
      "type": "product",
      "accessed": "2026-06-17"
    },
    {
      "id": "source-llms-txt",
      "title": "llms.txt proposal",
      "url": "https://github.com/answerdotai/llms-txt",
      "type": "protocol",
      "accessed": "2026-06-17"
    },
    {
      "id": "source-digital-gardens-appleton",
      "title": "A Brief History & Ethos of the Digital Garden",
      "url": "https://maggieappleton.com/nontechnical-gardening",
      "type": "design",
      "accessed": "2026-06-17"
    },
    {
      "id": "source-digital-gardens-qu",
      "title": "Digital Gardens",
      "url": "https://vivqu.com/blog/2020/10/18/digital-gardens/",
      "type": "design",
      "accessed": "2026-06-17"
    },
    {
      "id": "source-nng-cognitive-load",
      "title": "4 Principles for Reducing Cognitive Load in Forms",
      "url": "https://www.nngroup.com/articles/4-principles-reduce-cognitive-load/",
      "type": "design",
      "accessed": "2026-06-17"
    }
  ],
  "related": [
    {
      "type": "topic",
      "id": "topic:ai-native-publishing"
    },
    {
      "type": "topic",
      "id": "topic:digital-gardens"
    }
  ],
  "agentInstructions": [
    "Use claims as the retrieval unit.",
    "Prefer source IDs over inline citation guessing.",
    "Treat maturity=seed as an explicit uncertainty marker.",
    "Do not infer that Kimi WebBridge contributed; it was unavailable during implementation."
  ],
  "humanReview": {
    "status": "reviewed-with-agent-input",
    "reviewedAt": "2026-06-17",
    "reviewers": [
      "Codex main agent",
      "Locke UX reviewer",
      "Descartes article reviewer",
      "Boyle governance reviewer"
    ],
    "notes": "Initial seed article shaped through cross-agent review. Human author retains final judgment before public launch."
  },
  "contentHash": ""
}
